Category,Name,Location ,Justification,MLA Decision,Email Address,Best Contact,Notes
ACCELERATORS & INCUBATORS,SparkLabs Cultiv8,Australia,Leading agri-food tech accelerator partnering with MLA. Relevant to all challenges.,Yes,jonathon@sparklabscultiv8.com,Jonathon Quigley - Co-Founder & Partner (jonathon@sparklabscultiv8.com) OR Contact Form: https://www.sparklabscultiv8.com/contact-us,
ACCELERATORS & INCUBATORS,Rocket Seeder,Australia,Supports food/ag startups focused on sustainability. Portfolio includes sustainable packaging companies.,,,emma@rocketseeder.com,Emma Coath - Managing Director (LinkedIn: linkedin.com/in/emmacoath/) Email format: firstname@rocketseeder.com,
ACCELERATORS & INCUBATORS,Startupbootcamp FoodTech Tasmania,Australia,MLA partner. Seeking shelf-life technologies sustainable packaging food waste solutions.,,,info@startupbootcamp.org,Anna Barlow - Food Innovation Partner (Contact: https://www.startupbootcamp.org/accelerator/foodtech-tasmania),
ACCELERATORS & INCUBATORS,SproutX,Australia,Australia's leading agtech/foodtech hub. Portfolio includes plant protein and sustainable packaging.,,,info@sproutx.com.au,General Inquiries (info@sproutx.com.au),
ACCELERATORS & INCUBATORS,THRIVE APAC Accelerator,Australia,12-week program for Seed to Series A agrifood tech. Focus on sustainability and supply chain innovation.,,,info@svgpartners.com,General Inquiries (info@svgpartners.com),
ACCELERATORS & INCUBATORS,EnergyLab - Climate Solutions Accelerator,Australia,Australia's largest climate tech accelerator. Focus on sustainable materials alternative proteins packaging.,,,programs@energylab.org.au,Megan Fisher - CEO & Director (programs@energylab.org.au),
ACCELERATORS & INCUBATORS,Jumar Bioincubator,Australia,First biotech incubator co-located with CSL. Supports nutraceuticals functional foods biotech applications in food.,,,info@jumarbio.com,Contact Form: https://www.jumarbio.com/connect,
ACCELERATORS & INCUBATORS,CUREator (Brandon BioCatalyst),Australia,Australia's national biotech incubator. $40M MRFF funding for pre-clinical innovations.,,,info@cureator.com.au,General Inquiries (info@cureator.com.au),
ACCELERATORS & INCUBATORS,LaunchVic,Australia,Victoria's lead startup agency. Hugh Victor McKay Fund provides up to $200k co-investment for AgTech.,,,hello@launchvic.org, grants@launchvic.org,Kate Cornick - CEO (LinkedIn: linkedin.com/in/kate-cornick-62aab92b) Contact: hello@launchvic.org OR grants@launchvic.org,
ACCELERATORS & INCUBATORS,AgTech and Logistics Hub,Australia,Premier agribusiness innovation hub. 6500+ contacts 1000+ SMEs. Focus on supply chain optimization.,,,Owen.Williams@agtechlogisticshub.com.au,Owen Williams - Hub Manager (Owen.Williams@agtechlogisticshub.com.au),
ACCELERATORS & INCUBATORS,Farmers2Founders,Australia,LaunchVic funded. GROW 12-week pre-accelerator for Victorian AgTech.,,,Admin@farmers2founders.com,Dr Christine Pitt - Founder & Managing Director (LinkedIn: searchable) Contact: Admin@farmers2founders.com,
ACCELERATORS & INCUBATORS,HARVEST AgTech Accelerator (AgriStart),Australia,WA's AgTech accelerator for scaling startups. Farmer partnerships for trials. Now part of Innovation Cluster.,,,info@agristart.com.au,General Inquiries (info@agristart.com.au) - Note: Redirects to Innovation Cluster website,
ACCELERATORS & INCUBATORS,Proto Axiom,Australia,Patient capital with hands-on incubation. Early-stage biotech with applications in functional foods.,,,info@protoaxiom.com,General Inquiries (info@protoaxiom.com),
ACCELERATORS & INCUBATORS,NSW Government - Tech Central / MVP Ventures,Australia,NSW innovation hub supporting food tech clean tech. MVP Ventures provides funding.,,,contact@investment.nsw.gov.au,Investment NSW Contact: Phone 02 9000 1365 OR Contact Form: www.investment.nsw.gov.au/contact-us/,
ACCELERATORS & INCUBATORS,Breakthrough Victoria,Australia,Victorian Government innovation fund. Key investor in Jumar Bioincubator ($25M).,,,contact@breakthroughvictoria.com,General Inquiries (contact@breakthroughvictoria.com),
ACCELERATORS & INCUBATORS,Cicada Innovations,Australia,23-year track record supporting deep tech. Operates Jumar Bioincubator. Portfolio raised $1.8B+.,,,info@cicadainnovations.com,General Inquiries (info@cicadainnovations.com),
ACCELERATORS & INCUBATORS,Stone & Chalk - AgTech Program,Australia,Leading innovation hub with dedicated agtech program. Locations in Sydney Melbourne Adelaide.,,,jacqui@stoneandchalk.com.au, bc@stoneandchalk.com.au, graham.mccorkill@stoneandchalk.com.au,Jacqui Duncan - GM NSW (jacqui@stoneandchalk.com.au) OR Ben Colley - GM SA (bc@stoneandchalk.com.au) OR Graham McCorkill - Startup Success Manager VIC (graham.mccorkill@stoneandchalk.com.au),
ACCELERATORS & INCUBATORS,The Waite Campus (University of Adelaide),Australia,Largest agrifood hub in Southern Hemisphere. ThincLab startup community.,,,zrinka.tokic@adelaide.edu.au, thinclab@adelaide.edu.au,Zrinka Tokic - ThincLab Director (zrinka.tokic@adelaide.edu.au) OR General: thinclab@adelaide.edu.au,
ACCELERATORS & INCUBATORS,National Reconstruction Fund Corporation (NRFC),Australia,Federal fund providing debt equity guarantees to agriculture food processing advanced manufacturing.,,,foi@nrf.gov.au, NRF.Policy@industry.gov.au,Contact Form: www.nrf.gov.au/contact-us OR FOI: foi@nrf.gov.au OR Policy: NRF.Policy@industry.gov.au,
ACCELERATORS & INCUBATORS,AgriFutures GrowAg,Australia,Government-backed platform connecting agtech innovators researchers investors. 80000+ users.,,,connect@growag.com,David Lord or Rebecca Bradford (connect@growag.com) Phone: +61 2 6923 6936 / 6957,
ACCELERATORS & INCUBATORS,Food Innovation Precinct Western Australia (FIPWA),Australia,State-of-the-art food manufacturing and R&D facility. Focus on extended shelf life technologies.,,,info@fipwa.com.au,General Inquiries (info@fipwa.com.au),
UNIVERSITIES,Victoria University - Sustainable Packaging Research Group,Australia,Leading research in bio-packaging materials from agricultural wastes. Directly addresses Challenge A.,,,vincent.rouillard@vu.edu.au, marlene.cran@vu.edu.au, isilc@vu.edu.au,Professor Vincent Rouillard - Leader (vincent.rouillard@vu.edu.au) OR Dr Marlene Cran - Deputy Leader (marlene.cran@vu.edu.au) OR General: isilc@vu.edu.au,
UNIVERSITIES,RMIT University - Food Research and Innovation Centre,Australia,Multimillion-dollar facility for food processing product development nutrition packaging design.,,,harsharn.gill@rmit.edu.au,Professor Harsharn Gill - Food and Health Biosciences (harsharn.gill@rmit.edu.au) Phone: +61 3 9925 2600,
UNIVERSITIES,Monash University - Food Innovation Centre,Australia,World-class R&D for food science dairy processing biotechnology. Partnership with FIAL.,,,contact@foodinnovationcentre.com.au,General Inquiries (contact@foodinnovationcentre.com.au) Phone: +61 477 371 949,
UNIVERSITIES,Monash University - Commercialisation Office,Australia,Manages IP protection licensing commercialization of food science materials science biotechnology research.,,,Innovation@monash.edu,Monash Innovation (Innovation@monash.edu),
UNIVERSITIES,University of Melbourne - Food & Packaging Innovation Program,Australia,World's only dedicated Food & Packaging Innovation Master's program. Direct relevance to Challenge A and C.,,,samantha.fossey@unimelb.edu.au,Samantha Fossey (samantha.fossey@unimelb.edu.au) Phone: +61 3 9035 5511,
UNIVERSITIES,University of Melbourne - Commercialisation Office,Australia,Manages IP and commercialization for food science and materials innovations.,,,k.jefferd@unimelb.edu.au,Ken Jefferd - Executive Director Research Innovation & Commercialisation (k.jefferd@unimelb.edu.au) OR Contact: https://research.unimelb.edu.au/commercialisation/contact,
UNIVERSITIES,Deakin University - CASS Food Research Centre,Australia,Consumer Analytical Safety Sensory Food Research Centre. Specializes in food innovation sensory analysis.,,,cass@deakin.edu.au, pauline.braniff@deakin.edu.au,General Inquiries (cass@deakin.edu.au) OR Pauline Braniff (pauline.braniff@deakin.edu.au),
UNIVERSITIES,Deakin University - BioFactory,Australia,Transforms biomass and biosolid waste into biomaterials. Direct relevance to Challenge A.,,,colin.barrow@deakin.edu.au,Professor Colin Barrow - Lead Researcher (colin.barrow@deakin.edu.au),
UNIVERSITIES,La Trobe University - LISAF,Australia,Paddock to gut' approach integrating agriculture food innovation nutrition health.,,,c.pakes@latrobe.edu.au,Professor Chris Pakes - Deputy VC Research (c.pakes@latrobe.edu.au) Phone: 1300 LA TROBE (1300 528 762),
UNIVERSITIES,La Trobe University - Bio Innovation Hub,Australia,Purpose-built facility for biotechnology commercialization. Laboratory facilities for early-stage biotech.,,,industry.engagement@latrobe.edu.au,Megan Fisher - Pro VC Industry Engagement OR Sid Jain - Director Precinct Development (industry.engagement@latrobe.edu.au) Phone: +61 9479 2070 / +61 408 764 036,
UNIVERSITIES,UNSW Sydney - Food Science & Technology Programs,Australia,Only Australian program recognized by US Institute of Food Technologists. Comprehensive food science expertise.,,,contact@unsw.edu.au,Contact Form: www.unsw.edu.au/science/about-us/contact-us (School of Chemical Engineering),
UNIVERSITIES,UNSW Sydney - Knowledge Exchange & Commercialisation,Australia,Manages research commercialization IP protection industry partnerships.,,,knowledgeexchange@unsw.edu.au,General Inquiries (knowledgeexchange@unsw.edu.au),
UNIVERSITIES,UNSW Founders Program,Australia,Comprehensive entrepreneurship program for commercializing university research and startups.,,,unsw.founders@unsw.edu.au, founders.foundations@unsw.edu.au,General Inquiries (unsw.founders@unsw.edu.au) OR Foundations Program (founders.foundations@unsw.edu.au),
UNIVERSITIES,University of Sydney - Commercialisation Office,Australia,Manages IP and commercialization for food science materials science innovations.,,,commercialisation@sydney.edu.au,General Inquiries (commercialisation@sydney.edu.au),
UNIVERSITIES,University of Sydney - Centre for Advanced Materials Technology,Australia,Expertise in materials characterisation polymer-based materials biomaterials. Direct relevance to Challenge A.,,,amme.ea@sydney.edu.au, engineering.external@sydney.edu.au,School of AMME (amme.ea@sydney.edu.au) OR Industry: engineering.external@sydney.edu.au Phone: +61 2 9351 2341,
UNIVERSITIES,University of Newcastle - Food Science Research Group,Australia,Combines food plant science nutrition agribusiness research. Industry-focused.,,,chris.grof@newcastle.edu.au, Science-IT-SELS@newcastle.edu.au,Professor Chris Grof (chris.grof@newcastle.edu.au) Phone: +61 2 4921 5858 OR General: Science-IT-SELS@newcastle.edu.au,
UNIVERSITIES,University of Wollongong - Australian Institute for Innovative Materials (AIIM),Australia,World-leading multi-functional materials research including bio-based materials polymer research.,,,contact@uow.edu.au,General Inquiries - Phone: +61 2 4221 3271 OR Visit: www.uow.edu.au/research-and-innovation/our-research/research-institutes-and-facilities/australian-institute-for-innovative-materials/contact-us/,
UNIVERSITIES,University of Wollongong - Innovation & Commercial Research Office,Australia,Manages commercialization of materials science and engineering research.,,,george_tomka@uow.edu.au, research-services@uow.edu.au,George Tomka - Senior Manager (george_tomka@uow.edu.au) OR General: research-services@uow.edu.au Phone: +61 2 4221 8145,
UNIVERSITIES,University of Adelaide - Food Science & Innovation,Australia,Research in functional food development food processing technologies sustainable food sources.,,,andrew.lowe@adelaide.edu.au, foodlab@adelaide.edu.au,Professor Andrew Lowe - Director Food Innovation (andrew.lowe@adelaide.edu.au) OR General: foodlab@adelaide.edu.au,
UNIVERSITIES,University of Adelaide - Innovation & Commercialisation Services,Australia,Handles IP protection commercialization advice for food science and agricultural innovations.,,,commercialisation@adelaide.edu.au, businessdevelopment@adelaide.edu.au,Commercialisation Team (commercialisation@adelaide.edu.au) OR Business Development (businessdevelopment@adelaide.edu.au) Phone: +61 8 8313 4403,
UNIVERSITIES,University of Adelaide - Food Product Development Group,Australia,Provides ingredient development product development sensory testing shelf-life testing.,,,afw@adelaide.edu.au, foodlab@adelaide.edu.au,School of Agriculture Food & Wine (afw@adelaide.edu.au) OR Food Innovation Lab (foodlab@adelaide.edu.au) Phone: +61 8 8313 2699,
UNIVERSITIES,Curtin University - Food Science and Technology Programs,Australia,Master of Science (Food Science and Technology) biotechnology programs. Research in food security.,,,enquiries@curtin.edu.au,General Inquiries - Phone: 1300 222 888 OR Contact Form on website,
UNIVERSITIES,Australian National University (ANU) - Office of Business Engagement & Commercialisation,Australia,Manages commercialization of research including biotechnology food science materials science.,,,innovation@anu.edu.au,Innovation Team (innovation@anu.edu.au),
UNIVERSITIES,ANU - Materials Science Program,Australia,Master of Science in Materials Science focusing on biodegradable plastics biocompatible materials.,,,science.enquiries@anu.edu.au,College of Science Student Admin (science.enquiries@anu.edu.au),
UNIVERSITIES,ANU - Biotechnology Programs,Australia,Biotechnology programs focused on food security agriculture food production innovations.,,,science.enquiries@anu.edu.au, innovation@anu.edu.au,College of Science Student Admin (science.enquiries@anu.edu.au) OR General ANU Research: innovation@anu.edu.au,
UNIVERSITIES,University of Tasmania - Tasmanian Institute of Agriculture (TIA),Australia,Focus on food safety and innovation agricultural productivity food product development. 15+ research sites.,,,tia.enquiries@utas.edu.au,General Inquiries (tia.enquiries@utas.edu.au) Phone: +61 3 6226 2463,
UNIVERSITIES,University of Tasmania - Centre for Food Innovation (CFI),Australia,Partnership between UTAS and Defence Science and Technology. Focus on shelf-stable foods specialized nutrition.,,,John.Bowman@utas.edu.au,Professor John Bowman - Centre Leader (John.Bowman@utas.edu.au) Phone: +61 3 6226 6380,
UNIVERSITIES,Queensland Alliance for Agriculture and Food Innovation (QAAFI),Australia,UQ research institute with expertise in food science animal science nutrition. 15 research sites across Queensland.,,,qaafi@uq.edu.au, qaaficomms@uq.edu.au,General Inquiries (qaafi@uq.edu.au) Phone: +61 7 3346 0550 OR Business Development: Oliver Frith +61 439 771 373 OR Media: Natalie MacGregor (qaaficomms@uq.edu.au) +61 409 135 651,
INDUSTRY ASSOCIATIONS,Australian Meat Industry Council (AMIC),Australia,Represents 1500+ post-farmgate meat processors retailers smallgoods manufacturers.,,,info@amic.org.au, media@amic.org.au,General Inquiries (info@amic.org.au) OR Media: Jemma Harper (media@amic.org.au) Phone: 02 9086 2200,
INDUSTRY ASSOCIATIONS,Australian Meat Processor Corporation (AMPC),Australia,Specializes in innovation and R&D for red meat processing. Running innovation challenges.,,,admin@ampc.com.au, communications@ampc.com.au,General Inquiries (admin@ampc.com.au) OR Communications (communications@ampc.com.au),
INDUSTRY ASSOCIATIONS,Food Innovation Australia Limited (FIAL),Australia,Not-for-profit focused on growing Australian food globally. Innovation support R&D connections.,,,Rod.adenas@fial.com.au,Rod Adenas (Rod.adenas@fial.com.au) OR Contact via website: www.fial.com.au,
INDUSTRY ASSOCIATIONS,Australian Packaging Covenant Organisation (APCO),Australia,Leading circular economy development for packaging. 2300+ member organizations.,,,apco@apco.org.au,General Inquiries (apco@apco.org.au),
INDUSTRY ASSOCIATIONS,Australian Institute of Packaging (AIP),Australia,Peak professional body for packaging training. Runs packaging innovation forums.,,,info@aipack.com.au,General Inquiries (info@aipack.com.au) Phone: 07 3278 4490,
INDUSTRY ASSOCIATIONS,Circular Australia,Australia,Leading Australia's transition to circular economy by 2035. Industry taskforces on packaging materials.,,,contact@circularaustralia.com.au,Contact Form: https://circularaustralia.com.au/contact-us/,
INDUSTRY ASSOCIATIONS,Australian Institute of Food Science and Technology (AIFST),Australia,Peak professional body for food industry. 2000+ members across industry academia government.,,,aifst@aifst.com.au,General Inquiries (aifst@aifst.com.au) Phone: +61 447 066 324,
INDUSTRY ASSOCIATIONS,AusBiotech,Australia,Peak biotechnology industry body. 3000+ members. Hosts AusAg & Foodtech Summit.,,,admin@ausbiotech.org, membership@ausbiotech.org, eboscheinen@ausbiotech.org,General Contact (admin@ausbiotech.org) OR Membership (membership@ausbiotech.org) OR Media: Emma Boscheinen (eboscheinen@ausbiotech.org),
INDUSTRY ASSOCIATIONS,Materials Australia,Australia,Peak body for Australian materials scientists and engineers. National organization with state branches.,,,imea@materialsaustralia.com.au,General Inquiries (imea@materialsaustralia.com.au) Phone: +61 3 9326 7266,
INDUSTRY ASSOCIATIONS,Australian Materials Research Society (AMRS),Australia,Umbrella body connecting materials science researchers across Australia.,,,Jim.Williams@anu.edu.au, ia@science.org.au,Professor Jim Williams - President (Jim.Williams@anu.edu.au) OR General: Meaghan Dzundza (ia@science.org.au),
INDUSTRY ASSOCIATIONS,Cellular Agriculture Australia (CAA),Australia,Peak body for food biotechnology and biomanufacturing. Published white paper with ANU.,,,regulation@cellagaustralia.org,Regulatory Inquiries (regulation@cellagaustralia) OR Website: www.cellularagricultureaustralia.org,
INDUSTRY ASSOCIATIONS,Food Innovation Partners,Australia,Connects food companies with research investors government. 35+ years food industry experience.,,,russel@food-innovation.com.au,Russel (russel@food-innovation.com.au) Phone: 0411 178 227,
INDUSTRY ASSOCIATIONS,Australian Circular Economy Hub (Planet Ark),Australia,Federal Government-supported hub facilitating knowledge sharing for circular economy transition.,,,kristie@planetark.org,Kristie (kristie@planetark.org) for corporate partnerships,
INDUSTRY ASSOCIATIONS,SIFT Centre (Sustainable Innovative Food Technologies),Australia,State-of-the-art WA facility. HPP and novel processing technologies.,,,info@sift.au,Contact Form: https://sift.au/contact/ (operated by Future Food Systems CRC + Murdoch University),
INDUSTRY ASSOCIATIONS,Wholesale Food Group,Australia,27+ years experience in food product development contract manufacturing R&D.,,,sales@wholesalefoodgroup.com.au,Sales Team (sales@wholesalefoodgroup.com.au) Phone: (07) 5594 0444,
INDUSTRY ASSOCIATIONS,Australian Food Innovation Network (AFIN),Australia,National community bringing together industry universities researchers. Shelf Stable Food Program.,,,ingrid.appelqvist@csiro.au,Dr Ingrid Appelqvist - Research Group Leader (ingrid.appelqvist@csiro.au) OR Website: research.csiro.au/food-innovation/afin/,
ACCELERATORS & INCUBATORS,Plug and Play Food & Beverage,USA (Silicon Valley),"Stage-agnostic 12-week food innovation platform connecting startups with 500+ corporate partners. Focus areas include personalized nutrition, functional foods, protein alternatives, packaging innovation, and waste reduction. Directly relevant to all three challenges.",,,investment@plugandplaytechcenter.com,General Inquiries (investment@plugandplaytechcenter.com) Phone: (408) 524-1400,Global presence with 50+ locations. Corporate partners include Tetra Pak and DuPont Nutrition & Biosciences.
ACCELERATORS & INCUBATORS,IndieBio (SOSV),USA (San Francisco & New York),"World's #1 early-stage biotech accelerator supporting food biotechnology, agriculture innovation, and alternative proteins. Portfolio includes cultivated protein, functional foods, and novel processing technologies. Relevant to Challenges B and C.",,,contact@indiebio.co,Contact Form: https://indiebio.co/contact/,"Part of SOSV ecosystem. Notable portfolio: NotCo, Upside Foods, Perfect Day. Principal & Program Director: Westley Dang (LinkedIn searchable)"
ACCELERATORS & INCUBATORS,Techstars Farm to Fork,USA (Twin Cities),"Partnership with Ecolab accelerating digital innovation across food and ag supply chain. Focus on sustainability, food safety, and supply chain optimization. Relevant to shelf-life technologies and packaging (Challenge A and B).",,,brett@breadandbutterventures.com,Brett Brohl - Managing Director (LinkedIn: linkedin.com/in/brettbrohl),12-week program selecting 10-12 startups annually. Also founder of The Syndicate Fund.
ACCELERATORS & INCUBATORS,Big Idea Ventures,USA/Singapore/Paris,"Leading alternative protein investor. New Protein Fund invests $200K ($125K cash + $75K in-kind) in alternative protein and ingredients companies. Focus on functional foods, novel proteins, and food innovation. Directly relevant to Challenge C.",,,shruti.salkar@bigideadventures.com, andrew.ive@gmail.com,Andrew D. Ive - Founder & Managing General Partner (LinkedIn searchable) OR Media: shruti.salkar@bigideadventures.com,Twice-yearly cohorts. Backed by Bühler & Tyson. Three global locations.
ACCELERATORS & INCUBATORS,Yield Lab Institute,USA (St. Louis),"Non-profit dedicated to agrifood systems innovation. Launched H.A.R.V.E.S.T. AgTech platform in 2025 with 12 U.S. regional ecosystems + international reach (Argentina, Brazil, Israel, UK). Focus on food preservation, supply chain, packaging.",,,kyle@theyieldlab.com,Stephanie Regagnon - Executive Director (LinkedIn: linkedin.com/in/stephregagnon) OR kyle@theyieldlab.com,"Contact: 1100 Corporate Square Drive, Suite 212, St. Louis, MO 63132. www.harvestagtech.org"
ACCELERATORS & INCUBATORS,Radicle Growth,USA (San Diego) with Canada partnerships,"AgTech/FoodTech venture capital and accelerator. Nutrien-Radicle Challenge Canada supports Canadian innovation. Focus on supply chain optimization, food waste reduction, and sustainable agriculture technologies.",,,khaney@radicle.vc, ddougan@radicle.vc,Kirk Haney - Managing Partner (khaney@radicle.vc) OR Danielle Dougan (ddougan@radicle.vc) Phone: 978-430-9680,Partnerships with AVAC and Verdex Capital in Canada. $1.25M investment program for growth and seed-stage companies.
ACCELERATORS & INCUBATORS,Creative Destruction Lab (CDL) - AgriFood,Canada (Toronto/Calgary/Vancouver),"Canada's premier seed-stage accelerator with dedicated AgriFood stream. Connects startups with mentors, investors, and corporate partners across the ag value chain. Focus on scalable solutions from farm to consumer.",,,dora.tamas@creativedestructionlab.com, heather.marshall@creativedestructionlab.com,Dora Tamas - AgriFood Stream Manager (dora.tamas@creativedestructionlab.com) OR CDL-Rockies: heather.marshall@creativedestructionlab.com,Multiple Canadian locations. 9-month program. Relevant to packaging innovation and food preservation technologies.
ACCELERATORS & INCUBATORS,MaRS Discovery District - Food & AgTech Mission,Canada (Toronto),"Major Toronto innovation hub with new FoodTech venture accelerator (2025). Supports 10 Canadian startups in supply chain innovation, emissions reduction, waste reduction, and efficiency. FCC partnership brings industry leaders together.",,,partnerships@marsdd.com,Tyler Hamilton - Senior Director Climate (LinkedIn searchable) OR MaRS Partnerships team through www.marsdd.com/accelerators/,"Address: 101 College Street, Suite 100, Toronto, ON M5G 1L7. Coalition includes Wittington Ventures, S2G Investments, TELUS Agriculture."
ACCELERATORS & INCUBATORS,SKU Accelerator,USA (Austin),"Leading 12-week CPG accelerator for market-validated brands across food, beverage, pet care, and health & wellness. Focus on scaling innovative products with mentorship and retailer connections. Relevant to Challenge C (wellness products).",,,buff.greebe@sku.is,Buff Greebe - Executive Director ([email protected]) OR www.sku.is,Headquartered in Austin. Focus on women and BIPOC-owned businesses. Strong retail network for go-to-market strategy.
ACCELERATORS & INCUBATORS,Alchemist Accelerator,USA (San Francisco/Memphis),"Enterprise-focused accelerator with food tech and healthcare verticals. Memphis East Coast hub adjacent to logistics, supply chain, and healthcare leaders. Supports food preservation technology and B2B food innovation.",,,rachel@alchemistaccelerator.com,Rachel Chalmers - President & Managing Director (LinkedIn searchable) Phone: (415) 527-0158,www.alchemistaccelerator.com. 6-month program. Enterprise monetization focus relevant to B2B food technology.
INDUSTRY ASSOCIATIONS,Good Food Institute,USA (Washington DC),"Leading non-profit accelerating alternative protein innovation. Strategic support for startups, established companies, and meat producers. Focus on cultivated meat, plant-based proteins, and fermentation. Directly relevant to Challenge C.",,,philanthropy@gfi.org,Contact Form: gfi.org/contact OR Philanthropy team: philanthropy@gfi.org Phone: 202-596-2262,"Global presence with offices in USA, India, Europe, Brazil, and Asia-Pacific. Email format: [first].[last]@gfi.org"
COMPANIES,Anterra Capital,Netherlands (Amsterdam) & USA (Boston),"AgTech investment firm with $260M Fund II investing in biotech and digital solutions across agrifoodtech value chain. Focus on ag fintech, crop science, animal health, sustainable packaging, and functional foods.",,,info@anterracapital.com,Adam Anders - Managing Partner (LinkedIn searchable) OR Team page: anterracapital.com/team/,18-person team including 4 partners. Invests in innovations addressing agricultural productivity and sustainability.
