Category,Name,Location,Justification,MLA Decision,Best Contact,Notes
UNIVERSITIES,Institut Agro,France (Montpellier/Dijon/Rennes/Angers),"French scientific establishment under Ministry of Agriculture. 4,500 students, 300 teacher-researchers, 39 research units, 187 international partnerships. AgroValoMéditerranée business incubation site. Member of Euroleague for Life Sciences. All challenges relevant.",,Contact: contact@supagro.fr Phone: +33 (0)4 99 61 22 00,"Address: 2 place Pierre Viala, 34060 Montpellier. Six campuses. ECOTROPHELIA student food innovation contest. Partners with INRAE."
UNIVERSITIES,INRAE (National Research Institute for Agriculture Food and Environment),France (National),"France's leading agriculture, food and environment research institute. 450+ socio-economic partners, 15 high innovation potential fields, 4 Carnot Institutes. Extensive international partnerships (FAO, WHO, CGIAR, FAPESP). All challenges relevant.",,Collaboration: www.inrae.fr/en/collaborate OR International: www.inrae.fr/en/international,"Regional contact example: philippe.hinsinger@inrae.fr. LIAs (international associated laboratories) for joint projects. Partnership Officers available."
ACCELERATORS & INCUBATORS,Future Food Institute,Italy (Bologna),"Italian social enterprise with global horizons. Living Labs in Italy, US, Japan. Affiliate centers in China, Singapore, Germany. Future Food Accelerator facilitates open innovation between startups, business, global food ecosystem. All challenges relevant.",,General: info@futurefoodinstitute.org Phone: +39 051 656 9619 OR Pollica office: +39 3336417696,"Address: Piazza Giuseppe Verdi, 2, 40126 Bologna. Prosperity-driven alliances with government and industry. Sustainable food systems focus."
ACCELERATORS & INCUBATORS,Station F - ShakeUp Factory,France (Paris),"World's largest startup facility. ShakeUp Factory is exclusive food acceleration program at Station F. Oversees French hub of EIT Food. Innovation hub combining accelerator, open-innovation, experts network. All challenges relevant.",,Contact through: stationf.co OR ShakeUp Factory: shakeupfactory.co/startups,"1,000+ startups. Partners: Google, LVMH, Meta, HEC. 13th arrondissement Paris. ShakeUp Factory partners with Bridge2Food."
UNIVERSITIES,Fraunhofer IVV (Institute for Process Engineering and Packaging),Germany (Freising/Dresden),"Leading R&D for high-quality food and packaging. Focus on food technology, recycling, environment. CIRCULAR FoodPack coordinator. 13 Fraunhofer institutes in food alliance. Challenge A (packaging) highly relevant.",,General: +49 8161 491-0 OR Dr. Esra Kücükpinar (CIRCULAR FoodPack): esra.kucukpinar@ivv.fraunhofer.de +49 (0)8161 491-507,"Address: Giggenhauser Str. 35, 85354 Freising. Dresden division: Heidelberger Str. 20, 01189. 120+ industrial partners. www.ivv.fraunhofer.de"
UNIVERSITIES,University College Cork (UCC),Ireland (Cork),"Top Irish university for industry collaboration (Knowledge Transfer Ireland). School of Food and Nutritional Sciences recognized for research in food packaging, ingredients, supply chain. UCC Innovation Office handles commercialization. All challenges relevant.",,UCC Innovation: uccinnovation@ucc.ie +353 (0)21 4205880 OR Business & Industry: industry@ucc.ie,"Western Gateway Building, Western Road, Cork T12 XF62. Research Office: uccresearch@ucc.ie +353 (0)21 4903500. Strong food business programs."
UNIVERSITIES,DTU National Food Institute,Denmark (Søborg),"335 staff across five departments. Scientific advice to Danish authorities and international organizations. Close collaboration with Danish and international food companies. Strong technology transfer capability. All challenges relevant.",,General: food@food.dtu.dk Phone: +45 7234 7625,"Address: Mørkhøj Bygade 19, DK 2860 Søborg. Head of Studies contact: Marianne Uhre Jakobsen. www.food.dtu.dk"
UNIVERSITIES,Aarhus University - Department of Food Science,Denmark (Aarslev),"Top 100 university with extensive business collaborations. Centre for Innovative Food Research (iFOOD). EIT Food partner. Four strategic themes: Plant/food/environment, Climate friendly foods, Circularity, Food/health. All challenges relevant.",,Derek V. Byrne: derekv.byrne@food.au.dk Phone: +45-2878 2840,"Address: Kirstinebjergvej 10, DK-5792 Aarslev. Website: food.au.dk. Strong focus on dissemination and implementation for industry."
INDUSTRY ASSOCIATIONS,Vinnova (Sweden's Innovation Agency),Sweden (Stockholm),"Government agency enhancing Sweden's competitive edge and innovation capacity. Innovation platforms for sustainable food systems. Funding opportunities and collaboration platforms for green transition in food sector. All challenges relevant.",,Contact through: www.vinnova.se/en/,"Eight innovation platforms for sustainable food systems. Creates conditions to increase pace of food transition. Sweden Foodtech ecosystem support."